{
  "schema_version": "1",
  "slug": "self-future-me",
  "display_name": "未来的我",
  "profile_type": "self",
  "relationship_to_user": "自我投射，通过提炼自身模式辅助决策和成长",
  "use_case": "决策镜像和未来自我顾问，帮助识别盲点和长期偏好",
  "voice_mode": "first_person",
  "consent_status": {
    "person_consented": false,
    "distribution_allowed": false,
    "notes": "local private use unless explicitly changed"
  },
  "privacy_policy": {
    "raw_retention": "summary_only",
    "public_skill_allows_private_quotes": false
  },
  "export_policy": {
    "default_visibility": "private",
    "shareable_variants": [
      "advisor"
    ],
    "requires_privacy_review": true
  },
  "lifecycle": {
    "version": "v1",
    "created_at": "2026-04-29T00:00:00+00:00",
    "updated_at": "2026-04-29T00:00:00+00:00"
  }
}